Title,Summary,Published,Link,Source,Country,Language,Duration,NoOfArticles
Polio eradication review meeting says not a single case of polio reported since Feb 10,"Prime Minister Shehbaz Sharif on Thursday was informed that not a single case of polio had been reported in the country since February 10 due to the dedicated efforts of the nationwide anti-polio campaigns. Pakistan is one of the last two countries in the world, alongside Afghanistan, where polio remains endemic, with the disease mostly affecting children under five, and sometimes causing lifelong paralysis. Despite global efforts to eradicate the virus, challenges such as security issues, vaccine hesitancy, and misinformation have slowed progress . The country recorded a total of 74 cases in 2024. Of these, 27 were found in Balochistan, 23 in Sindh, 22 in Khyber Pakhtun­khwa, and one each in Punjab and Islamabad. This year’s first nationwide polio vaccination campaign was held in Feb, followed by a fractional IPV-OPV Polio (injectable polio vaccine) campaign in Quetta and Karachi on Feb 20 and 22, respectively.  Around 1 million children were targeted for vaccination in this campaign, according to the officials. Chairing the review meeting on Polio eradication in Islamabad today, the prime minister was told that as a result of the dedicated nationwide anti-polio campaigns, not a single case of polio had been reported in the country since February 10. According to The Associated Press of Pakistan (APP) , the premier commended the efforts of relevant government institutions, international organisations, and partners to make Pakistan polio-free. He directed the relevant authorities to ensure awareness and community mobilisation regarding the anti-polio campaign across the country. “It must be ensured that every child under five years of age is administered the polio vaccine during the anti-polio campaign starting from April 21,” he said. He emphasised that alongside the campaign, nationwide routine immunisation for protection against other dangerous diseases should also be fully ensured. “Despite challenging conditions, the workers participating in the anti-polio campaign are playing a frontline role in the fight against this disease,” the prime minister said, adding that the entire nation, including himself, was proud of the hardworking polio workers. The premier was briefed about the upcoming anti-polio campaign from April 21 to April 27, during which 4.5m children will be given the polio vaccine. A total of 415,000 polio workers would participate in this nationwide campaign. The meeting was informed that, as per the prime minister’s instructions, third-party validation of the campaign would be completed from April 28 to April 30. Moreover, the cold chain tracking of the anti-polio campaigns was being monitored under a digital system. The meeting was attended by Federal Minister for Health Syed Mustafa Kamal, Prime Minister’s Focal Person for Polio Eradication Ayesha Raza, Sindh Health Minister Dr Azra Fazal Pechuho, chief secretaries of all four provinces, Azad Jammu and Kashmir, and Gilgit-Baltistan, representatives of international partners, and other senior relevant officials. Sindh campaign to vaccinate over 10.6m children under 5 Separately, the Sindh government, in a statement, said that it was launching a province-wide polio vaccination campaign from April 21 to 27, aiming to vaccinate more than 10.6m children under the age of five against the virus. According to a statement issued by the Sindh Emergency Operations Centre (EOC), in Karachi alone, over 2.76m children would be targeted during the campaign. To ensure every eligible child was provided with the vaccine, approximately 69,724 trained polio workers would go door-to-door, as well as visit schools, shopping malls, and transit points across the province. Out of these, over 20,000 would be deployed in Karachi. A comprehensive security plan was in place, with 24,552 security personnel deployed to protect polio workers and support teams during the week-long campaign, of which 5,669 would be in Karachi. “Each dose of the polio vaccine is critical to building a child’s protection against this crippling disease. Parents must cooperate fully with vaccinators during the campaign and ensure every child receives the vaccine, every time,” APP said, quoting Irshad Ali Sodhar, EOC’s provincial coordinator. Sindh EOC mobilised district administrations, religious leaders, medical associations, and media organisations to help promote vaccination awareness and counter misinformation. Citizens were urged to fully cooperate with polio teams and encourage their families and communities to ensure that no child is left unvaccinated. If any child under the age of five has missed their polio drops, call the helpline 1166 or WhatsApp at 0346-7776546, the statement said. Presiding over a meeting of the Provincial Task Force for Polio Eradication, Sindh Chief Minister Murad Ali Shah said that the province reported four polio cases in 2025, compared to 23 in 2024 and 2 in 2023, emphasising the need for enhanced oversight and coordination across all districts in preparation for the upcoming vaccination campaign. “Our efforts this year must be focused on ensuring that every child receives the polio vaccine,” he said. Sindh Health Minister Dr Azra Pechuho informed the chief minister that the province reported four cases of polio in 2025. The CM stressed the importance of district-level leadership in reaching every child and overcoming parental hesitancy through respectful, data-driven engagement. “Every refusal must be seen as an opportunity to educate and build trust,” he stated. “Deputy Commissioners must lead from the front and ensure daily supervision in the field.” Sukkur, Larkana, Hyderabad, and Mirpurkhas divisions have also had polio virus-positive environmental surveillance results. Therefore, parents must ensure their children are vaccinated properly and regularly to protect them from polio, the CM said. Dr Pechuho highlighted the need for sustained follow-up in communities affected by misinformation or vaccine fatigue. “We must strengthen the role of supervisors and ensure two to three visits to every household where vaccination was initially refused,” she said. “We must also continue integrating nutrition and routine immunisation with polio campaigns.” The chief minister concluded by urging all officials and elected representatives to support the polio teams during the campaign. “The virus is still present, but so is our resolve. We owe it to every child to make this campaign count,” he stated. “Let Sindh lead the way toward a polio-free Pakistan.”","Thu, 17 Apr 2025 18:31:32 +0500",https://www.dawn.com/news/1904858/polio-eradication-review-meeting-says-not-a-single-case-of-polio-reported-since-feb-10,Dawn News,Pakistan,en,Today,75
Bill to establish commission for minority rights approved by Senate subcommittee,"The Senate Subcommittee on Human Rights on Thursday approved a bill to establish a commission on minority rights in accordance with United Nations and international standards and regulations. The meeting was chaired by Senator Ali Zafar, Convener of the Senate subcommittee. According to a copy of the bill seen by Dawn.com , the commission will “assess and monitor [the] implementation of the constitutional guarantees and safeguard for promotion and protection of rights of minorities”. It will also review existing or proposed policies or programmes to prevent discrimination and protect minorities, and provide recommendations to the relevant departments. According to the bill, the commission established by the prime minister will consist of 13 members, including two minority members from each province — a woman and a representative of the largest minority in that province. Additionally, the commission will include one minority member from Islamabad and one grade 21 officer each from the Ministry of Human Rights, the Ministry of Law and Justice, the Ministry of Interfaith Harmony and the Interior Ministry. “The chairperson and every other member … shall hold office for a term of three years,” the bill read. “There shall be a council to be established under this act,” the bill read. “The council shall exercise all powers, perform all functions, do all acts and things which
[are] assigned to it by the commission.” This 18-member council will include three Hindu members — including two from the scheduled caste — three Christian members; three Sikh members; one member friom Bahai; two Muslim members; an ex-officio member from the Council of Islamic Ideology; a representative of the Evacuee Trust Property Board; one representative each from the Provincial Human Rights or Minorities Affairs Departments; and one minority member from Islamabad. According to the bill, the commission may request information or a report from government institutions if it is inquiring a violation of minority rights. “Provided that if the information or report is not received within the time stipulated for the purpose, the Commission may proceed to inquire into the complaint on its own,” the bill added. “Without prejudice to anything contained in sub-section (1), if the commission considers it necessary, having regard to [the] nature of the complaint, it may initiate an inquiry without calling for any information or report.” “Today is a historic day for minorities which will be remembered forever,” Senator Zafar said, addressing the subcommittee. Human rights groups both in Pakistan and across the world have called on the government to protect the rights of minorities. In an open letter written on National Minorities Day last August, the Human Rights Commission of Pakistan’s National Interfaith Working Group — comprising leaders from various faith communities, as well as lawyers, journalists, and human rights defenders — demanded stronger protection for minorities.","Thu, 17 Apr 2025 17:27:15 +0500",https://www.dawn.com/news/1904861/bill-to-establish-commission-for-minority-rights-approved-by-senate-subcommittee,Dawn News,Pakistan,en,Today,75
More than 130 students in US join federal lawsuit over revoked visas,"More than 130 international students across the United States have joined a federal lawsuit accusing the Trump administration of unlawfully cancelling their visas, jeopardising their legal status in the country, court documents show. The students allege that the Immigration and Customs Enforcement agency (ICE) abruptly and illegally terminated their status in the government’s Student and Exchange Visitor Information System (Sevis) database, putting them at risk of arrest, detention and deportation. The initial complaint was filed by 17 students on April 11 in the state of Georgia.
Since then, 116 more have joined them as the administration of US President Donald Trump pursues a wide-ranging immigration crackdown that has targeted foreign students, among many others. Across campuses in the United States, international students have been scrambling as they have discovered their visas have been revoked, often for little or no reason, according to court documents and media reports. The Georgia lawsuit names US Attorney General Pam Bondi, Homeland Security Secretary Kristi Noem and Acting ICE Director Todd Lyons as defendants and seeks to reinstate the revoked visas. In the complaint, which does not identify the students by name “due to fear of retaliation”, the summaries offered for each of the 17 original cases reveal seemingly arbitrary cancellations, with each plaintiff giving their best guess as to what may have prompted them to be targeted. Some pointed to minor traffic infringements, such as John Doe 2, a Chinese citizen pursuing an engineering doctorate at the Georgia Institute of Technology. He was notified by his school that his visa was revoked after a criminal records check, but the violation was not specified. The student believes it may have been related to a traffic offence that was closed, and according to the filing, he has no other criminal history. Another of the students, an Indian national at New York Institute of Technology, said he had been found not guilty of shoplifting, and the case was dismissed. “Over the past week, visa revocations and Sevis terminations have shaken campuses across the country,” the complaint says. “The Sevis terminations have taken place against the backdrop of numerous demands being made of universities by the federal government and threats of cutting off billions of dollars in federal funding.” The suit also noted that students’ removal from the government database could jeopardise the individuals’ ability to reenter the United States in the future.","Thu, 17 Apr 2025 19:01:31 +0500",https://www.dawn.com/news/1904863/more-than-130-students-in-us-join-federal-lawsuit-over-revoked-visas,Dawn News,Pakistan,en,Today,75
"UN nuclear chief says Iran, US running out of time to secure deal","UN nuclear watchdog chief Rafael Grossi said on Thursday that Iran and the United States were running out of time to secure a deal. Iranian and US delegations are to gather in Rome on Saturday for a second round of Omani-mediated negotiations, a week after the longtime foes held their highest-level talks since US President Donald Trump abandoned a landmark nuclear accord in 2018. “We are in a very crucial stage of these important negotiations. We know we don’t have much time, this is why I am here … to facilitate this process,” Grossi said on a visit to Tehran. “We are working hard and we want to succeed,” he told a joint news conference with Iran’s atomic energy agency chief Mohammad Eslami, acknowledging that the search for a deal was “not an easy process”. On Wednesday, Grossi met with Foreign Minister Abbas Araghchi, who led the first round of talks with US Special Envoy Steve Witkoff on Saturday. Araghchi said he had a “useful” meeting with the International Atomic Energy Agency (IAEA) chief. “The IAEA can play a crucial role in the peaceful settlement of the Iranian nuclear file in the coming months,” he said. Araghchi called on the IAEA chief to “keep the agency away from politics” in the face of “spoilers” seeking to “derail current negotiations”. He did not elaborate. Grossi said their meeting was “important”. “Cooperation with IAEA is indispensable to provide credible assurances about the peaceful nature of Iran’s nuclear programme at a time when diplomacy is urgently needed,” he said on X. Screenshot of Rafael Grossi’s post on X on his meeting with Seyed Abbas Araghchi, foriegn minister of Iran. — @rafaelmgrossi on X ‘Not far’ from possessing bomb Before heading to Iran, Grossi told French newspaper Le Monde that Tehran was “not far” from possessing a nuclear bomb. Western governments have long accused Iran of seeking to acquire a nuclear weapons capability, an ambition Tehran has consistently denied . A year after Trump pulled out of the 2015 nuclear deal, Iran began rolling back its own commitments under the agreement, which gave it relief from sanctions in return for IAEA-monitored restrictions on its nuclear activities. In its latest report , the IAEA said Iran had an estimated 274.8 kilogrammes (605 pounds) of uranium enriched to up to 60 per cent. That level far exceeds the 3.67pc enrichment ceiling set by the 2015 deal, but still falls short of the 90pc threshold required for a nuclear warhead. Since he returned to office in January, Trump has revived his “maximum pressure” policy of punishing economic sanctions against Iran. In March, he sent a letter to Iran’s supreme leader Ayatollah Ali Khamenei urging talks and warning of possible military action if Iran refused. On Thursday, the New York Times reported that Trump had blocked an Israeli plan to strike Iranian nuclear facilities in favour of seeking a negotiated deal. ‘Conflicting positions’ On Tuesday, Khamenei cautioned that while the talks with the US had started well, they could yet prove fruitless. “The negotiations may or may not yield results,” he said . On Wednesday, Araghchi said Iran’s enrichment of uranium was not up for discussion after Witkoff called for a halt. Witkoff had previously demanded only that Iran return to the 3.67 percent enrichment ceiling set by the 2015 deal. Araghchi said he hoped to start negotiations on the framework of a possible agreement, but that this required “constructive positions” from the US. “If we continue to (hear) contradictory and conflicting positions , we are going to have problems,” he warned. On Thursday, Iran’s top diplomat headed to Moscow on a “pre-planned” visit to the Tehran ally. The Kremlin said that Russia stood ready to do “everything” in its power to help resolve the standoff over Iran’s nuclear programme.","Thu, 17 Apr 2025 18:23:53 +0500",https://www.dawn.com/news/1904849/un-nuclear-chief-says-iran-us-running-out-of-time-to-secure-deal,Dawn News,Pakistan,en,Today,75
"Sindh govt committed to addressing transport, water and sanitation challenges: CM Murad","Sindh Government reaffirmed its commitment towards addressing Karachi’s urban mobility, water, and sanitation issues at a meeting with International Finance Corporation (IFC) delegation on Thursday. With a population of 20 million, infrastructure issues in Karachi run rampant, ranging from transport , water and sanitation. Last year, urban planners and climate change experts said that Karachi had become an “unliveable” city due to pollution, crumbling infrastructure, poor sanitation and waste management system. The meeting focused on future public-private partnership (PPP) initiatives and underscored the need for strengthening PPPs in sectors such urban mobility and water, sanitation, and hygiene (WASH) as the chief minister detailed Sindh’s legal and institutional framework regarding PPPs. He also highlighted progress in sectors such as road networks, energy, health, education, and transport.  The IFC delegation was led by Linda Rudo Munyengeterwa, Director for Public-Private Partnerships, Privatisations & Corporate Finance Advisory. During the meeting, held at the CM House, CM Murad emphasised Sindh government’s commitment to addressing Karachi’s transport, water and sanitation challenges, highlighting the city’s importance as Pakistan’s economic hub. To this end, he pointed out the Sindh government’s efforts in terms of transport which included several Bus Rapid Transit (BRT) systems, including the Green and Orange lines. Meanwhile, he said, work was underway on yellow and red lines along with other infrastructure projects. He further added that the Sindh government had already introduce d e-buses in Karachi and planned to expand its fleet to 800 vehicles. The IFC lead delegate outlined a mass transit strategy comprising four main components: BRT operations, urban rail systems, ferry services, and ride-hailing platforms. She suggested constructing a new 18.3 km BRT system in Karachi, financed through the World Bank, along with an integrated feeder bus network. The IFC also stressed the need for modern e-buses to reduce noise and air pollution in the city. It recommended implementing e-buses through PPP models, where operational costs, maintenance, and risks would be shared with private partners. The lead delegate talked about IFC’s experience in advising on over 500 projects globally and emphasised the advantages of e-buses, including cost efficiency, lower maintenance, and environmental sustainability, she informed that by 2024, 80 per cent of urban transport buses in successful models would be e-buses. Addressing Karachi’s water woes, the chief minister stated that Karachi requires 1,200 million gallons of water daily, stating that the current supply is insufficient, resulting in a significant shortfall. In this regard, he highlighted the under-construction K-IV project which is expected to add to the water supply once completed. The government is also working on plans to install desalination plants to treat seawater, he confirmed. The CM expressed interest in initiating water-related projects through the PPP model to address the water crisis while the IFC also recommended establishing water treatment plants for industrial use and proposed that water supply and sanitation projects follow the PPP model. The nine-member International Finance Corporation (IFC) delegation included: Country Manager Zeeshan Sheikh, regional Manager Ian Twinn, Regional Manager Mr Tonci Bakovic, Regional Operational Manager Mr Michael Opagi among others. From the Sindh government, Karachi Mayor Murtaza Wahab, Principal Secretary Agha Wasif, Chairman P&D Board Najam Shah, Finance Secretary Fayaz Jatoi, DG PPP Unit Asad Zamin, and other senior officials were present. The IFC team presented various successful global PPP models and praised the Sindh government’s PPP Unit and its overall policy framework. “Sindh is a province that has been implementing PPPs since 2008, and it truly stands as an example of how public-private partnerships should be done”, said Munyengeterwa while insisting on the need for more public-private partnerships. Expressing excitement at the prospect of future partnership opportunities, Munyengeterwa said, “IFC looked forward to showcase Sindh as a model for other provinces and even other countries”. “Hopefully, your success can serve as an international example of how to do PPPs the right way,” she added. The IFC and the Sindh government agreed to collaborate closely on future PPP initiatives in urban mobility and water management to improve service delivery and urban infrastructure in Karachi and beyond.","Thu, 17 Apr 2025 17:40:15 +0500",https://www.dawn.com/news/1904859/sindh-govt-committed-to-addressing-transport-water-and-sanitation-challenges-cm-murad,Dawn News,Pakistan,en,Today,75
