Title,Summary,Published,Link,Source,Country,Language,Duration,NoOfArticles
Retired nutritious meal scheme workers stage demonstration,,"Thu, 17 Apr 2025 18:36:24 +0530",https://www.thehindu.com/news/cities/Madurai/retired-nutritious-meal-scheme-workers-stage-demonstration/article69460814.ece,The Hindu,India,en,Today,162
Karnataka lorry strike called off after government assures action on truckers’ demands,Transport Minister Ramalinga Reddy said that the government has assured the Federation of Karnataka State Lorry Owners and Agents’ Association that it will take necessary steps to address their concerns.,"Thu, 17 Apr 2025 18:36:20 +0530",https://www.thehindu.com/news/national/karnataka/karnataka-lorry-strike-called-off-after-government-assures-action-on-truckers-demands/article69460867.ece,The Hindu,India,en,Today,162
"Watch: FOMO Fix: The good, the bad and the ugly on film and TV this week","A look at Ajith Kumar’s Good Bad Ugly, Black Mirror’s terrifying tech futures, and a sex-positive show about cancer","Thu, 17 Apr 2025 18:32:51 +0530",https://www.thehindu.com/videos/watch-fomo-fix-the-good-the-bad-and-the-ugly-on-film-and-tv-this-week/article69460927.ece,The Hindu,India,en,Today,162
Collector disburses ₹89 lakh-worth welfare assistance; urges villagers to enter dairy farm business,,"Thu, 17 Apr 2025 18:31:27 +0530",https://www.thehindu.com/news/cities/Madurai/collector-disburses-89-lakh-worth-welfare-assistance-urges-villagers-to-enter-dairy-farm-business/article69460783.ece,The Hindu,India,en,Today,162
Water level in Mullaperiyar dam stands at 113.90 feet,,"Thu, 17 Apr 2025 18:30:07 +0530",https://www.thehindu.com/news/cities/Madurai/water-level-in-mullaperiyar-dam-stands-at-11390-feet/article69460864.ece,The Hindu,India,sv,Today,162
Pakistan may try but its reputation as epicentre of global terrorism will not diminish: India,India strongly rejects Pakistan’s claims on Kashmir and says Pakistan’s reputation as a “global terrorism epicenter will not diminish” and extradition of 26/11 accused Tahawwur Rana to India is a “reminder”,"Thu, 17 Apr 2025 18:28:56 +0530",https://www.thehindu.com/news/national/pakistan-may-try-but-its-reputation-as-epicentre-of-global-terrorism-will-not-diminish-india/article69460812.ece,The Hindu,India,en,Today,162
Orders for anklets decrease in Salem as silver bar prices go up,,"Thu, 17 Apr 2025 18:27:50 +0530",https://www.thehindu.com/news/cities/Coimbatore/orders-for-anklets-decrease-in-salem-as-silver-bar-prices-go-up/article69460141.ece,The Hindu,India,en,Today,162
Vellore Corporation passes resolution to give pattas to those living on poromboke land,,"Thu, 17 Apr 2025 18:26:55 +0530",https://www.thehindu.com/news/national/tamil-nadu/vellore-corporation-passes-resolution-to-give-pattas-to-those-living-on-poromboke-land/article69460723.ece,The Hindu,India,en,Today,162
Stalin pays tribute to freedom fighter Dheeran Chinnamalai,,"Thu, 17 Apr 2025 18:26:46 +0530",https://www.thehindu.com/news/national/tamil-nadu/stalin-pays-tribute-to-freedom-fighter-dheeran-chinnamalai/article69460305.ece,The Hindu,India,en,Today,162
YSRCP supporter arrested in Hyderabad for social media post,The party activists protest against the arrest,"Thu, 17 Apr 2025 18:24:06 +0530",https://www.thehindu.com/news/national/andhra-pradesh/ysrcp-supporter-arrested-in-hyderabad-for-social-media-post/article69460444.ece,The Hindu,India,en,Today,162
Museum at Lakkundi to showcase cultural heritage of Kalyani Chalukyas gains traction,"The museum will offer visitors a glimpse into the built heritage bequeathed by the Kalyani Chalukyas, who ruled parts of central Karnataka and the Deccan between the 10th and the 12th centuries CE.","Thu, 17 Apr 2025 18:23:40 +0530",https://www.thehindu.com/news/national/karnataka/museum-at-lakkundi-to-showcase-cultural-heritage-of-kalyani-chalukyas-gains-traction/article69460565.ece,The Hindu,India,en,Today,162
Government Museum in Chennai set to get a facelift,"A sum of ₹4 crore will be allocated to renovate the facility’s geology, botany, zoology, and anthropology galleries","Thu, 17 Apr 2025 18:20:52 +0530",https://www.thehindu.com/news/national/tamil-nadu/government-museum-in-chennai-set-to-get-a-facelift/article69460540.ece,The Hindu,India,en,Today,162
Visakhapatnam’s Bharadwaj Dayala on a world tour to capture one million portraits of women,"Bharadwaj Dayala is on a road trip across the world, covering 195 countries for an ambitious 12-year-project that aims to document stories of one million women through their portraits","Thu, 17 Apr 2025 18:20:39 +0530",https://www.thehindu.com/life-and-style/travel/visakhapatnams-bharadwaj-dayala-on-a-world-tour-to-capture-one-million-portraits-of-women/article69459517.ece,The Hindu,India,en,Today,162
"Sports complex in Ramanathapuram to get upgraded synthetic athletic track, grass turf football stadium",,"Thu, 17 Apr 2025 18:19:43 +0530",https://www.thehindu.com/news/cities/Madurai/sports-complex-in-ramanathapuram-to-get-upgraded-synthetic-athletic-track-grass-turf-football-stadium/article69459944.ece,The Hindu,India,en,Today,162
Thoothukudi district collector announces farm pond initiative to combat water scarcity in the regions to rainfed agriculture,(with photo/ Rajesh),"Thu, 17 Apr 2025 18:18:27 +0530",https://www.thehindu.com/news/cities/Madurai/thoothukudi-district-collector-announces-farm-pond-initiative-to-combat-water-scarcity-in-the-regions-to-rainfed-agriculture/article69460759.ece,The Hindu,India,en,Today,162
Youth inflicts cut injury on woman;  loots money from tea shop near Aruppukottai,PIC MOORTHY,"Thu, 17 Apr 2025 18:16:20 +0530",https://www.thehindu.com/news/cities/Madurai/youth-inflicts-cut-injury-on-woman-loots-money-from-tea-shop-near-aruppukottai/article69460679.ece,The Hindu,India,en,Today,162
"Punnapra South, Veeyapuram grama panchayats secure A grade in PAI report",,"Thu, 17 Apr 2025 18:15:00 +0530",https://www.thehindu.com/news/national/kerala/punnapra-south-veeyapuram-grama-panchayats-secure-a-grade-in-pai-report/article69460214.ece,The Hindu,India,en,Today,162
Shivamogga City Corporation employees stage protest; seek benefits on par with other govt. employees,,"Thu, 17 Apr 2025 18:12:33 +0530",https://www.thehindu.com/news/national/karnataka/shivamogga-city-corporation-employees-stage-protest-seek-benefits-on-par-with-other-govt-employees/article69460491.ece,The Hindu,India,en,Today,162
"Man arrested for ‘posting’ obscene remarks against Deputy Chief Minister Pawan Kalyan and his son on social media, says Guntur SP",,"Thu, 17 Apr 2025 18:11:49 +0530",https://www.thehindu.com/news/national/andhra-pradesh/man-arrested-for-posting-obscene-remarks-against-deputy-chief-minister-pawan-kalyan-and-his-son-on-social-media-says-guntur-sp/article69460304.ece,The Hindu,India,en,Today,162
Itel A95 5G launched with Dimensity processor and 50 MP camera for entry segment buyers,"Itel A95 5G has an AI assistant, Aivana, that can do grammar check, text generation, and content discovery","Thu, 17 Apr 2025 18:02:25 +0530",https://www.thehindu.com/sci-tech/technology/gadgets/itel-a95-5g-launched-with-dimensity-processor-and-50-mp-camera-for-entry-segment-buyers/article69460805.ece,The Hindu,India,en,Today,162
"Top news of the day: SC pauses appointments, denotifications under Waqf Act till next hearing; SC allows W.B. Govt to retain ‘untainted’ teachers for now, orders fresh hiring by Dec. 31, and more",The major news headlines of the day and more,"Thu, 17 Apr 2025 17:52:01 +0530",https://www.thehindu.com/news/top-news-of-the-day-april-17-2025/article69460337.ece,The Hindu,India,en,Today,162
Water level in Papanasam dam,,"Thu, 17 Apr 2025 17:50:28 +0530",https://www.thehindu.com/news/cities/Madurai/water-level-in-papanasam-dam/article69460421.ece,The Hindu,India,id,Today,162
Gold chains snatched from women in Salem,,"Thu, 17 Apr 2025 17:49:18 +0530",https://www.thehindu.com/news/cities/Coimbatore/gold-chains-snatched-from-women-in-salem/article69460641.ece,The Hindu,India,en,Today,162
The Articulate Festival showed how poetry finds diverse interpretations in dance,"Ashimbandhu Bhattacharjee, Deepak Majumdar and Aruna Mohanty performed at the sixth edition of the festival held recently in Bengaluru","Thu, 17 Apr 2025 17:47:39 +0530",https://www.thehindu.com/entertainment/dance/the-articulate-festival-showed-how-poetry-finds-diverse-interpretation-in-dance/article69456397.ece,The Hindu,India,en,Today,162
On World Heritage Day looking at how music and dance festivals help in heritage conservation,"Culture departments, festival curators and heritage conservationists are constantly drawing up innovative ideas to keep the curiosity about the past alive.","Thu, 17 Apr 2025 17:47:26 +0530",https://www.thehindu.com/entertainment/music/how-culture-festivals-organised-at-forts-and-palaces-help-in-heritage-conversation/article69460741.ece,The Hindu,India,en,Today,162
Four-day building exhibition in Coimbatore from today,,"Thu, 17 Apr 2025 17:45:36 +0530",https://www.thehindu.com/news/cities/Coimbatore/four-day-building-exhibition-in-coimbatore-from-today/article69460198.ece,The Hindu,India,en,Today,162
Coonoor residents demand capture and relocation of sloth bear,,"Thu, 17 Apr 2025 17:30:38 +0530",https://www.thehindu.com/news/cities/Coimbatore/coonoor-residents-demand-capture-and-relocation-of-sloth-bear/article69460223.ece,The Hindu,India,en,Today,162
Explore Ladakh’s hidden villages and wildlife with regenerative travel experiences,"Headed to Leh this summer? We bring you an insider’s guide to exploring Ladakh’s untapped potential, with lesser-known destinations and unique experiences that foster regenerative tourism","Thu, 17 Apr 2025 17:22:05 +0530",https://www.thehindu.com/life-and-style/travel/explore-ladakhs-hidden-villages-and-wildlife-with-regenerative-travel-experiences/article69183400.ece,The Hindu,India,en,Today,162
"India's air quality way off WHO markers, need to scale up LPG subsidy scheme: Director",,"Thu, 17 Apr 2025 17:17:35 +0530",https://www.thehindu.com/sci-tech/health/indias-air-quality-way-off-who-markers-need-to-scale-up-lpg-subsidy-scheme-director/article69460362.ece,The Hindu,India,en,Today,162
Building lives through blocks,"The earliest known building blocks were introduced in the 18th century by educationalist Friedrich Fröbel. Fröbel, who was the founder of kindergarten, introduced “Fröbel’s Gifts” in the early 1800s, a set of geometric blocks that encouraged children to explore shapes, structures, and patterns. These blocks laid the foundation and influenced the design of modern building blocks.","Thu, 17 Apr 2025 17:15:00 +0530",https://www.thehindu.com/children/building-lives-through-blocks-the-history-of-building-blocks-from-wood-to-lego/article69372965.ece,The Hindu,India,en,Today,162
V-P Dhankhar scoffs at judges who act as ‘Super Parliament’ for prescribing timeline to President on deciding State bills,"Last week, the Supreme Court had, for the first time prescribed that the President should decide on the bills reserved for her consideration by the governor within three months from the date such reference is received.","Thu, 17 Apr 2025 17:14:40 +0530",https://www.thehindu.com/news/national/vice-president-dhankhar-supreme-court-judges-president-state-bills-timeline/article69460514.ece,The Hindu,India,en,Today,162
Anitha Guha’s ‘Parishvanga Pattabhishekam’ highlighted the enduring appeal of the epic,"The thematic production had episodes from Bala, Ayodhya and Aranya Kandams","Thu, 17 Apr 2025 17:13:09 +0530",https://www.thehindu.com/entertainment/dance/anitha-guhas-parishvanga-pattabhishekam-highlighted-the-enduring-appeal-of-the-epic/article69460572.ece,The Hindu,India,en,Today,162
Yadavan Chandran’s ‘Meanwhile Elsewhere’ turns the stage into a picture of realism,"Based on Italo Calvino’s Invisible Cities, Yadavan Chandran’s ‘Meanwhile Elsewhere’ offers a chance to understand life’s calmness, complexity and confusion; Mallika Sarabhai as Marco Polo leads the process.","Thu, 17 Apr 2025 17:11:04 +0530",https://www.thehindu.com/entertainment/dance/yadavan-chandrans-meanwhile-elsewhere-turns-the-stage-into-a-picture-of-realism/article69460596.ece,The Hindu,India,en,Today,162
Daily Quiz | On Gabriel Garcia Marquez,"Acclaimed author Gabriel Garcia Marquez died on April 17, 2014. Here is a quiz on the literary ‘magician’","Thu, 17 Apr 2025 17:10:00 +0530",https://www.thehindu.com/books/books-authors/daily-quiz-on-gabriel-garcia-marquez/article69459821.ece,The Hindu,India,en,Today,162
U.S. Homeland Security Department threatens to revoke Harvard’s ability to enrol foreign students,"With 6,793 international students attending Harvard, they comprise 27.2% of its enrolment in the 2024-25 academic year, according to the university’s data","Thu, 17 Apr 2025 17:09:48 +0530",https://www.thehindu.com/news/international/us-homeland-security-threatens-to-revoke-harvards-ability-to-enrol-foreign-students/article69460407.ece,The Hindu,India,en,Today,162
Chief Secretary directs officials to prevent drinking water crisis,"The CS directed collectors to ensure timely supply of water through tankers, lease private water sources if needed, and repair or rehabilitate temporary supply systems, hand pumps","Thu, 17 Apr 2025 17:08:17 +0530",https://www.thehindu.com/news/national/andhra-pradesh/chief-secretary-directs-officials-to-prevent-drinking-water-crisis/article69460545.ece,The Hindu,India,en,Today,162
"Infosys Q4 profit declines 11.7% to ₹7,033 crore; revenue rises to ₹40,925 crore","Infosys reports 11.7% decline in net profit for March quarter, exceeds revenue guidance, highest-ever free cash generation","Thu, 17 Apr 2025 17:07:48 +0530",https://www.thehindu.com/business/Industry/infosys-q4-profit-declines-117-to-7033-crore-revenue-rises-to-40925-crore/article69460553.ece,The Hindu,India,en,Today,162
Beyond the display case | What should India’s new museums include?,"The blueprint for India’s museums of tomorrow includes immersive experiences, digital connectivity and gamification","Thu, 17 Apr 2025 17:06:21 +0530",https://www.thehindu.com/entertainment/art/india-museums-beyond-the-display-case-immersive-gamification-digital-connectivity/article69455433.ece,The Hindu,India,en,Today,162
"APSCHE Chairman Madhu Murthy appointed as in-charge Chancellor of RGUKT, Nuzvid",,"Thu, 17 Apr 2025 17:04:26 +0530",https://www.thehindu.com/news/national/andhra-pradesh/apsche-chairman-madhu-murthy-appointed-as-in-charge-chancellor-of-rgukt-nuzvid/article69460377.ece,The Hindu,India,en,Today,162
"‘Vaadivaasal’: Suriya-Vetri Maaran film to go on floors in June, says producer Kalaipuli S Thanu","The veteran producer also defended Vetri Maaran amidst criticism against the director’s previous film ‘Viduthalai 2’, which received for flak for “poor lip syncing and shoddy production quality”","Thu, 17 Apr 2025 16:59:47 +0530",https://www.thehindu.com/entertainment/movies/vaadivaasal-vaadi-vaasal-suriya-vetrimaaran-vetri-maaran-kalaipuli-s-thanu-release-date/article69460415.ece,The Hindu,India,en,Today,162
Ex-R&AW Chief's revelations nothing new: Mehbooba on Abdullah's 'support' for Article 370 abrogation,PDP President Mehbooba Mufti not surprised by revelations in book “The Chief Minister and the Spy” about Farooq Abdullah’s support of abrogation of Article 370,"Thu, 17 Apr 2025 16:58:16 +0530",https://www.thehindu.com/news/national/jammu-and-kashmir/ex-raw-chiefs-revelations-nothing-new-mehbooba-on-abdullahs-support-for-article-370-abrogation/article69460246.ece,The Hindu,India,en,Today,162
Rupee sheds U.S. tariff impact; ends 27 paise higher at 85.37 against U.S. dollar,"The rupee strengthens against the dollar, closing at 85.37 on April 17, 2025, due to foreign fund inflows and equity gains","Thu, 17 Apr 2025 16:51:49 +0530",https://www.thehindu.com/business/markets/rupee-sheds-us-tariff-impact-ends-27-paise-higher-at-8537-against-us-dollar/article69460441.ece,The Hindu,India,en,Today,162
"Jharkhand BJP stages protest, demands resignation of Minority Affairs Minister over remarks on Constitution","Mr. Hasan, who courted controversy on April 14 for his alleged ""Shariat over Constitution"" remark, however, later claimed his comment was misconstrued by the media and asserted that both Shariat and Constitution were equally important for him","Thu, 17 Apr 2025 16:48:02 +0530",https://www.thehindu.com/news/national/jharkhand/jharkhand-bjp-stages-protest-demands-resignation-of-minority-affairs-minister-over-remarks-on-constitution/article69460381.ece,The Hindu,India,en,Today,162
Three arrested for possession and sale of ‘Hydro Ganja’ in Guntur;  ₹7.5 lakh worth drugs seized,,"Thu, 17 Apr 2025 16:45:43 +0530",https://www.thehindu.com/news/national/andhra-pradesh/three-arrested-for-possession-and-sale-of-hydro-ganja-in-guntur-75-lakh-worth-drugs-seized/article69460343.ece,The Hindu,India,en,Today,162
Colossal squid caught on camera for first time in deep sea,"The squid filmed was a juvenile about 1 foot in length. Adult colossal squids, which scientists have uncovered from the bellies of whales and seabirds, can reach lengths up to 23 feet","Thu, 17 Apr 2025 16:43:28 +0530",https://www.thehindu.com/sci-tech/science/colossal-squid-caught-on-camera-for-first-time-in-deep-sea/article69460433.ece,The Hindu,India,en,Today,162
Karnataka Caste Survey | The complete coverage,"The 50-volume report is derived out of the data collected during the survey conducted by the commission headed by H. Kantharaj in 2015, at the cost of ₹192 crore, but submitted by his successor K. Jayaprakash Hegde in 2024.","Thu, 17 Apr 2025 16:43:17 +0530",https://www.thehindu.com/news/national/karnataka/karnataka-caste-survey-the-complete-coverage/article69460396.ece,The Hindu,India,en,Today,162
KTM 390 Enduro R Debuts in India: Purpose-Built for Dual Terrain Bike,"Bringing KTM’s Enduro lineage to Indian soil, the new 390 Enduro R is engineered for both urban use and off-road exploration. The model blends off-road capability with essential road-going features.","Thu, 17 Apr 2025 16:38:59 +0530",https://www.thehindu.com/life-and-style/motoring/ktm-390-enduro-r-debuts-in-india-purpose-built-for-dual-terrain-bike/article69460288.ece,The Hindu,India,en,Today,162
"Sensex, Nifty surge nearly 2% amid U.S.-Japan tariff talks, FII inflows","The 30-share BSE benchmark Sensex jumped 1,508.91 points or 1.96% to reclaim the 78,000 level","Thu, 17 Apr 2025 16:36:37 +0530",https://www.thehindu.com/business/markets/sensex-nifty-surge-nearly-2-amid-us-japan-tariff-talks-fii-inflows/article69460382.ece,The Hindu,India,en,Today,162
"Why no FIR in burnt cash discovery at judge's house case, questions Vice-President Dhankhar",Mr. Dhankhar also questioned the legal standing of the three-judge panel carrying out an in-house probe into the matter,"Thu, 17 Apr 2025 16:36:01 +0530",https://www.thehindu.com/news/national/why-no-fir-in-burnt-cash-discovery-at-judges-house-case-questions-vice-president-dhankhar/article69460338.ece,The Hindu,India,en,Today,162
Case against YSRCP activist for derogatory social media post,,"Thu, 17 Apr 2025 16:35:38 +0530",https://www.thehindu.com/news/national/andhra-pradesh/case-against-ysrcp-activist-for-derogatory-social-media-post/article69460188.ece,The Hindu,India,en,Today,162
トランプ大統領「非常に生産的な会談」日米交渉から一夜明け,アメリカのトランプ大統領は関税措置をめぐる日本との交渉から一夜明けた17日朝、自身のSNSに「きのうメキシコの大統領と、非常に生産的な電話会談を行った。同じように日本の最高レベルの貿易代表団とも会った。非常に生産的な会談だった」と投稿しました。そのうえで「中国を含め、どの国も会いたがっている。きょうはイタリアだ」としています。17日には、ホワイトハウスでイタリアのメローニ首相と会談する予定です。,"Thu, 17 Apr 2025 22:31:33 +0900",http://www3.nhk.or.jp/news/html/20250417/k10014782441000.html,NHK,Japan,ja,Today,52
赤澤大臣 トランプ大統領と会談 閣僚交渉で措置見直し強く要求,アメリカの関税措置をめぐり赤澤経済再生担当大臣は、トランプ大統領との会談や閣僚交渉に臨み、見直しを強く求めました。そして双方は、可能な限り早期に合意し、首脳間での発表を目指すとともに、次回の交渉を今月中に実施できるよう日程調整を進めることで一致しました。さらに政府関係者などへの取材で、トランプ大統領との会談に至ったいきさつなども明らかになってきました。,"Thu, 17 Apr 2025 22:14:46 +0900",http://www3.nhk.or.jp/news/html/20250416/k10014781391000.html,NHK,Japan,ja,Today,52
中国 米関税政策めぐり 国連安保理で非公式の会合開催を要請,アメリカのトランプ政権の関税政策をめぐり、中国は国連の安全保障理事会で非公式の会合の開催を要請し、中国としては各国に参加を呼びかけることでトランプ政権に対する圧力としたいねらいがあるとみられます。,"Thu, 17 Apr 2025 21:01:47 +0900",http://www3.nhk.or.jp/news/html/20250417/k10014782281000.html,NHK,Japan,ja,Today,52
日本サッカー協会 運営の医療施設が診療報酬を不正請求,日本サッカー協会は、福島県で運営する医療施設が実際にはしていない医師の診察を行ったと偽って患者にリハビリテーションを行い診療報酬を不正に請求していたなどとして、厚生労働省から戒告の行政措置を受けたことを明らかにしました。金額は数千万円に上る見込みで、調査が済み次第、返還するとしています。,"Thu, 17 Apr 2025 21:49:08 +0900",http://www3.nhk.or.jp/news/html/20250417/k10014782401000.html,NHK,Japan,ja,Today,52
無料ウェブサービスに落とし穴 設定ミスで個人情報閲覧も,無料で使えるウェブサービスに落とし穴です。自分たちのグループ内で、メールなどが共有できるグーグルの無料サービスで、一部のユーザーの住所や携帯番号などの個人情報が、外部から閲覧できる状態になっていたことがわかりました。ユーザーの管理者が、グループを作成する際に設定を誤ったことが原因とみられ専門家は「サービスを使う側はよく調べてから使うべきだ」と指摘しています。※記事後半では注意点をQ＆Aで掲載しています。,"Thu, 17 Apr 2025 19:55:07 +0900",http://www3.nhk.or.jp/news/html/20250417/k10014781801000.html,NHK,Japan,ja,Today,52
都内大手ホテル カルテル・独禁法違反のおそれ 公取委が警告へ,都内の大手ホテルを運営する15社が客室単価などの内部情報を共有していたことがわかり、公正取引委員会が不正に価格を引き上げるカルテルにつながり独占禁止法違反にあたるおそれがあるとして、近く警告を出す方針を固めたことが関係者への取材で分かりました。,"Thu, 17 Apr 2025 21:29:02 +0900",http://www3.nhk.or.jp/news/html/20250417/k10014781571000.html,NHK,Japan,ja,Today,52
欧州中央銀行 0.25％利下げ決定 6会合連続 経済下支えねらいも,ヨーロッパ中央銀行は17日に開いた金融政策を決める理事会で0.25％の利下げを決めました。金利の引き下げは去年9月から6会合連続となります。決定の背景には、ユーロ圏の物価の伸び率が鈍化傾向となっているうえにアメリカのトランプ政権による関税措置によって景気の減速が懸念され、経済を下支えするねらいもあるものとみられます。,"Thu, 17 Apr 2025 21:25:17 +0900",http://www3.nhk.or.jp/news/html/20250417/k10014782421000.html,NHK,Japan,ja,Today,52
Nissan management shake-up plans reported as sharks circle,"Nissan is considering a change in leadership following poor results and the failure of a proposed merger with Honda, according to a report citing unnamed sources.","Thu, 27 Feb 2025 15:53:00 +0900",https://www.japantimes.co.jp/business/2025/02/27/companies/nissan-ceo-change/,The Japan Times,Japan,en,1 Year Ago,52
Japanese sake brewery to make foray into Indian market,"Takahashi Shouten, based in the city of Yame in Fukuoka Prefecture, launched a subsidiary in India in February.","Tue, 17 Dec 2024 12:53:00 +0900",https://www.japantimes.co.jp/business/2024/12/17/companies/sake-brewery-india/,The Japan Times,Japan,en,1 Year Ago,52
Toyota eyes lunar rover powered by regenerative fuel-cell tech,Toyota has teamed up with JAXA since 2019 to develop the manned lunar rover — which it dubbed the Lunar Cruiser — that they hope can be put on the moon in 2029.,"Sat, 22 Jul 2023 17:11:00 +0900",https://www.japantimes.co.jp/news/2023/07/22/business/corporate-business/toyota-moon-rover/,The Japan Times,Japan,en,2 Years Ago,52
British PM Rishi Sunak avoids wipeout in key local elections,"By-elections were seen as an indicator of the two main parties' prospects at a time when voters are struggling with high inflation, strikes and rising mortgage rates.","Fri, 21 Jul 2023 17:50:00 +0900",https://www.japantimes.co.jp/news/2023/07/21/world/politics/uk-sunak-avoids-wipeout-local-elections/,The Japan Times,Japan,en,2 Years Ago,52
