Title,Summary,Published,Link,Source,Country,Language,Duration,NoOfArticles
Errant drivers to be brought to book in pilot scheme,"Police announced on Wednesday a new pilot programme to monitor traffic violations at four locations using security cameras starting on Tuesday, with the aim of enhancing road safety and enforcement efficiency.

The initiative will leverage the Transport Department’s existing traffic control and surveillance system, including CCTV systems, to detect unsafe driving.

Fixed penalty notices will be issued to offenders once drivers are identified through captured licence plate details and timestamps of violations.

The superintendent of traffic management at the traffic branch headquarters, Nip Hoi-kwan, said the programme expands enforcement capabilities.

""In the past, the Transport Department's traffic control and surveillance system did not have video recording capabilities,"" Nip said. 

""The purpose of this plan is simply to provide officers with an additional enforcement option.

""Based on traffic conditions or their experience, officers will assess when congestion is likely to be more serious, and during those times, personnel will be sent to the control centre to monitor the traffic situation and activate the recording function.""

The first phase targets Queen’s Road Central's intersections with Ice House Street, Pedder Street and Bonham Strand as well as the Queen's Road East intersection with Wong Nai Chung Road.

The superintendent of the enforcement and control division of traffic Hong Kong Island, Mak Chung-kit, said these sites were chosen due to recurring violations and their disproportionate impact on broader traffic flow.

""In the past, we have continuously deployed our officers, whether for patrolling, law enforcement or directing traffic, and have invested a significant amount of manpower and resources,"" Mak said.

""However, traffic violations and congestion at the affected locations often reoccur shortly after our officers leave. 

""We found that the effectiveness of our officers' presence is very short-lived.

""At these four locations, traffic violations such as illegal parking, illegal pick-ups and drop-offs or yellow box junction obstructions can cause congestion that, even in a very short period of time, will impact nearby major roads and even affect trunk roads.""

The police said the aim is to bolster public compliance with traffic laws, reduce accident risks and alleviate congestion through sustained monitoring.

The three-month pilot will undergo a review before potential expansion, with outcomes informing future enforcement strategies.","Wed, 16 Apr 2025 10:53:09 +0800",https://news.rthk.hk/rthk/en/component/k2/1800578-20250416.htm,RTHK News,Hong Kong,en,This Week,20
"HK eyes e-commerce, silver economy amid challenges","Hong Kong needs to seek new growth opportunities amid global uncertainties, such as developing e-commerce and the silver economy, says Secretary for Commerce and Economic Development Algernon Yau. 

Speaking on RTHK's Overview Policy programme on Wednesday, Yau said geopolitical challenges and supply-chain disruptions are affecting the city's economy.

""Under these circumstances, Hong Kong must seek new ways forward,"" he said. 

""There are many good examples, such as the chief executive leading multiple visits to the Middle East and Asean countries.""

While the SAR has traditionally relied on trade with Europe and the United States, there is a need to seek new economic partnerships to mitigate geopolitical influences, Yau said. 

Noting the mainland's impressive e-commerce transaction volumes last year, he said online shopping is one key area that Hong Kong can tap into. 

Yau said a shopping festival held in August attracted a good response from the mainland, with 230 brands participating and more than 90 million impressions on discussion forums and the official website. 

The minister also highlighted the importance of developing a silver economy, noting that around one-third of Hong Kong's population – or 2.67 million people – will be over 65 years old by 2043. 

""While we need to address welfare issues for elderly people from grassroots groups, there are also many middle-class or better-off seniors who own properties and have pension funds,"" he said. 

""How can we stimulate consumption among this demographic? 

""Despite their substantial economic power, society seems to pay little attention to their spending needs,"" Yau said.

A government working group on the silver economy is focused on five areas: boosting consumption, developing the industry, promoting quality assurance, enhancing financial security and unleashing productivity.","Wed, 16 Apr 2025 10:23:40 +0800",https://news.rthk.hk/rthk/en/component/k2/1800565-20250416.htm,RTHK News,Hong Kong,en,This Week,20
HK junior fencing team wins bronze in Wuxi,"Hong Kong, China's junior men’s epee team made history at the World Cadets and Juniors Fencing Championships in Wuxi, clinching their first-ever bronze medal in the event - a landmark achievement for the SAR. 

The quartet of Gao Ying-chuen, Kenton Hsu, Wong Chi-ho, and Yuen Nok-man stormed through the early rounds, overcoming the Netherlands, Germany and Ukraine in succession to secure a spot in the semifinals. 

Although they were stopped by Canada in their quest for gold, the team regrouped for a dramatic bronze-medal showdown against Hungary.

In a tense finale, Hong Kong narrowly edged out their rivals 45-43. 

Trailing 23-25 at halftime, Yuen turned the tide with a gritty 3-1 rally in the sixth round to level the score at 26-26. 

Wong then ignited a commanding 9-3 surge, propelling Hong Kong to a 35-29 lead and cementing their path to victory.

Italy claimed gold in the event, with Canada securing silver. 

The men’s team bronze, combined with Wu Haidi’s earlier third-place finish in the women’s cadet individual epee, capped Hong Kong’s campaign with two medals - a record haul for the SAR at the championships.","Wed, 16 Apr 2025 09:06:34 +0800",https://news.rthk.hk/rthk/en/component/k2/1800547-20250416.htm,RTHK News,Hong Kong,en,This Week,20
HK to suspend parcel postal services to the US,"Hongkong Post announced on Wednesday an immediate suspension of parcel services to the United States via surface mail, due to the longer shipping time as small parcels are due to be hit by US tariffs from May 2.

It said it would contact the senders of such mail to make return and refund arrangements from April 22 if their parcels had not yet been shipped to the US.

For air parcels, services will stop from April 27.

""The US is unreasonable, bullying and imposing tariffs abusively. Hongkong Post will definitely not collect any so-called tariffs on behalf of the US and will suspend the acceptance of postal items containing goods destined to the US,"" a statement said.

Other postal items containing documents only without goods will not be affected.","Wed, 16 Apr 2025 09:03:45 +0800",https://news.rthk.hk/rthk/en/component/k2/1800564-20250416.htm,RTHK News,Hong Kong,en,This Week,20
GBA is a big draw for tourists: CE,"Chief Executive John Lee said the Greater Bay Area (GBA) offers a key development opportunity for local tourism. 

Lee made the comments in a speech at the 2025 World Tourism Cities Federation Hong Kong Fragrant Hills Tourism Summit held in the SAR on Tuesday.

The CE pointed out that the GBA has a population of over 86 million and a combined GDP rivalling that of the world's 10th largest economy.

""What it means is a consumer market and source of tourists that is over 10 times as large as our own city. What it also means, with our country’s facilitation measures for travellers, is that visitors who choose to visit this part of the world have much more cities to add to their itinerary,"" Lee said.

""We are fast developing in multi-destination tourism for an interconnected world.""

Lee also said the SAR is dedicated to free and open trade, despite global trade tensions.","Tue, 15 Apr 2025 21:41:03 +0800",https://news.rthk.hk/rthk/en/component/k2/1800516-20250415.htm,RTHK News,Hong Kong,en,This Week,20
HK 'is a pivotal region for I&T development',"An association representing global mobile operators said on Tuesday Hong Kong is a pivotal region for the development of innovation and technology and that it can learn from the mainland. 

The Groupe Speciale Mobile Association (GSMA) said operators on the mainland and in Hong Kong are leaders in the development and implementation of artificial intelligence solutions. 

Speaking after the Asia-Pacific Summit of the World Internet Conference, association chief executive and director John Hoffman said Hong Kong should make use of its development centres and talent to further promote AI development.

""[The companies] are leading in many aspects of not only the development of AI through companies like DeepSeek and others that are pushing the boundaries of AI, but then to turn around and implement them in a way that it benefits society,"" he said.

""It's not technology for technology's sake, but it's technology for the betterment of industry, businesses, government and of course society.""

Hoffman said the mainland has some of the largest mobile operators in the world and Hong Kong should make use of its proximity to the mainland to learn from the firms.

""I think Hong Kong has proven in the past that it's a place of export,"" he said. 

""It's a place where others can learn from... Hong Kong must seize that opportunity to learn from the mainland, then adapt and modify to its local conditions.

""Hopefully the rest of the world can look to Hong Kong and say 'This is a great solution. Let me try something similar'.""

The Digital Policy Office on Tuesday released guidelines on the application of generative AI, aiming to facilitate the safe and responsible use of AI by the industry and the public.

Hoffman said guidelines on the use of AI must be localised but stressed that they should be established under a framework that allows innovation to further develop.","Tue, 15 Apr 2025 18:35:07 +0800",https://news.rthk.hk/rthk/en/component/k2/1800495-20250415.htm,RTHK News,Hong Kong,en,This Week,20
Macron announces joint Franco-Haiti commission to examine shared past,"PARIS (Reuters) -     French President Emmanuel Macron said he intends to set up a joint Franco-Haitian commission to examine France's shared past with its former Caribbean colony, which won its independence 200 years ago on April 17, 1825. Read full story","Thu, 17 Apr 2025 21:51:00 +08:00",https://www.thestar.com.my/news/world/2025/04/17/macron-announces-joint-franco-haiti-commission-to-examine-shared-past,The Star,Malaysia,en,Today,50
Trump challenges judges&#039; probes of compliance with deportation orders,"NEW YORK (Reuters) -     The Trump administration is appealing efforts by two judges to investigate whether government officials defied their rulings over the deportation of migrants to El Salvador, escalating a confrontation between the executive and judicial branches Read full story","Thu, 17 Apr 2025 21:48:00 +08:00",https://www.thestar.com.my/news/world/2025/04/17/trump-challenges-judges039-probes-of-compliance-with-deportation-orders,The Star,Malaysia,en,Today,50
"MACC Economy Ministry form special team to monitor state, district projects",PUTRAJAYA: The Malaysian Anti-Corruption Commission (MACC) and the Economy Ministry have jointly formed a special team to monitor projects approved by the ministry at the state and district levels. Read full story,"Thu, 17 Apr 2025 21:40:00 +08:00",https://www.thestar.com.my/news/nation/2025/04/17/macc-economy-ministry-form-special-team-to-monitor-state-district-projects,The Star,Malaysia,en,Today,50
Russia removes Afghan Taliban from list of banned terrorist groups,"MOSCOW (Reuters) -     Russia on Thursday suspended its ban on the Taliban, which it had designated for more than two decades as a terrorist organisation, in a move that paves the way for Moscow to normalise ties with the leadership of Afghanistan. Read full story","Thu, 17 Apr 2025 21:30:00 +08:00",https://www.thestar.com.my/news/world/2025/04/17/russia-removes-afghan-taliban-from-list-of-banned-terrorist-groups,The Star,Malaysia,en,Today,50
High Court rules it has jurisdiction to hear lawsuit against Raghad,"KUCHING: The High Court here on Thursday (April 17) ruled that it has jurisdiction to hear the lawsuit filed by the sons of the late Tun Abdul Taib Mahmud, Sarawak's seventh Governor, against their stepmother, Toh Puan Raghad Kurdi Taib. Read full story","Thu, 17 Apr 2025 21:18:00 +08:00",https://www.thestar.com.my/news/nation/2025/04/17/high-court-rules-it-has-jurisdiction-to-hear-lawsuit-against-raghad,The Star,Malaysia,en,Today,50
"Jalur Gemilang gaffe: Sin Chew Daily editors detained, to be released tonight, says IGP","KUALA LUMPUR: The Chief Editor and Deputy Chief Sub-editor of the Sin Chew Daily newspaper, who were summoned to Bukit Aman on Thursday (April 17) to assist in investigations regarding the publication of an incomplete illustration of the Jalur Gemilang on the newspaper's front page, have been detained. Read full story","Thu, 17 Apr 2025 21:13:00 +08:00",https://www.thestar.com.my/news/nation/2025/04/17/jalur-gemilang-gaffe-sin-chew-daily-editors-detained-to-be-released-tonight-says-igp,The Star,Malaysia,en,Today,50
Mission to set up field hospital in Myanmar put on hold,"TAPAH: The mission to deploy medical officers to Myanmar to set up a field hospital, which was scheduled to depart yesterday, has been postponed at the request of Myanmar's authorities, says Foreign Minister Datuk Seri Mohamad Hasan. Read full story","Thu, 17 Apr 2025 20:51:00 +08:00",https://www.thestar.com.my/news/nation/2025/04/17/mission-to-set-up-field-hospital-in-myanmar-put-on-hold,The Star,Malaysia,en,Today,50
"Cops discover ketum processing facility during raid in Penang, two nabbed",BALIK PULAU: A double-storey terrace house on Jalan Kelicap here was discovered to be a processing facility for ketum juice during a police raid on Thursday (April 17). Read full story,"Thu, 17 Apr 2025 20:50:00 +08:00",https://www.thestar.com.my/news/nation/2025/04/17/cops-discover-ketum-processing-facility-during-raid-in-penang-two-nabbed,The Star,Malaysia,en,Today,50
Local man denies insulting the King online,"JOHOR BARU: A local man has denied making a social media post insulting His Majesty Sultan Ibrahim, King of Malaysia, which has gone viral. Read full story","Thu, 17 Apr 2025 20:40:00 +08:00",https://www.thestar.com.my/news/nation/2025/04/17/local-man-denies-insulting-the-king-online,The Star,Malaysia,en,Today,50
China ready to share rare earth processing technology with Malaysia,"TAPAH: China is poised to share its rare earth processing technology with Malaysia, a move that could substantially enhance the commodity's value in the global market. Read full story","Thu, 17 Apr 2025 20:40:00 +08:00",https://www.thestar.com.my/news/nation/2025/04/17/china-ready-to-share-rare-earth-processing-technology-with-malaysia,The Star,Malaysia,en,Today,50
"UN nuclear chief says Iran, US running out of time to secure deal","TEHRAN : UN nuclear watchdog chief Rafael Grossi said Thursday that Iran and the United States were running out of time to secure a deal as they prepare to hold fresh nuclear talks this weekend. Iranian and US delegations are to gather in Rome on Saturday for a second round of Omani-mediated negotiations, a week after the longtime foes held their highest-level talks since US President Donald Trump abandoned a landmark nuclear accord in 2018. “We are in a very crucial stage of these important negotiations. We know we don’t have much time, this is why I am here ... to facilitate this process,“ Grossi said on a visit to Tehran. “We are working hard and we want to succeed,“ he told a joint news conference with Iran’s atomic energy agency chief Mohammad Eslami, acknowledging that the search for a deal was “not an easy process”. On Wednesday, Grossi met with Foreign Minister Abbas Araghchi, who led the first round of talks with US Special Envoy Steve Witkoff on Saturday. Araghchi said he had a “useful” meeting with the International Atomic Energy Agency chief. “The IAEA can play a crucial role in peaceful settlement of the Iranian nuclear file in the coming months,“ he said. Araghchi called on the IAEA chief to “keep the agency away from politics” in the face of “spoilers” seeking to “derail current negotiations”. He did not elaborate. ‘Not far’ from possessing bomb Before heading to Iran, Grossi told French newspaper Le Monde that Tehran was “not far” from possessing a nuclear bomb. Western governments have long accused Iran of seeking to acquire a nuclear weapons capability, an ambition Tehran has consistently denied. A year after Trump pulled out of the 2015 nuclear deal, Iran began rolling back its own commitments under the agreement, which gave it relief from sanctions in return for IAEA-monitored restrictions on its nuclear activities. In its latest report, the IAEA said Iran had an estimated 274.8 kilogrammes (605 pounds) of uranium enriched to up to 60 percent. That level far exceeds the 3.67 percent enrichment ceiling set by the 2015 deal, but still falls short of the 90 percent threshold required for a nuclear warhead. Since he returned to office in January, Trump has revived his “maximum pressure” policy of punishing economic sanctions against Iran. In March, he sent a letter to Iran’s supreme leader Ayatollah Ali Khamenei urging talks and warning of possible military action if Iran refused. On Thursday, the New York Times reported that Trump had blocked an Israeli plan to strike Iranian nuclear facilities in favour of seeking a negotiated deal. ‘Conflicting positions’ On Tuesday, Khamenei cautioned that while the talks with the United States had started well, they could yet prove fruitless. “The negotiations may or may not yield results,“ he said. On Wednesday, Araghchi said Iran’s enrichment of uranium was not up for discussion after Witkoff called for a halt. Witkoff had previously demanded only that Iran return to the 3.67 percent enrichment ceiling set by the 2015 deal. Araghchi said he hoped to start negotiations on the framework of a possible agreement, but that this required “constructive positions” from the United States. “If we continue to (hear) contradictory and conflicting positions, we are going to have problems,“ he warned. On Thursday, Iran’s top diplomat was in Moscow on a “pre-planned” visit to the Tehran ally. Kremlin aide Yuri Ushakov said Araghchi would meet Russian President Vladimir Putin later in the day. “Our regular exchanges with Russia and China have allowed us to align our positions,“ Araghchi said on his arrival in the Russian capital. Meanwhile, the official Saudi Press Agency reported that Defence Minister Prince Khaled bin Salman had travelled to Tehran for talks on Thursday. During his first term, Trump attempted to forge an alliance between Israel and the Gulf Arab states against Iran. But in 2023 Tehran and Riyadh restored ties in a Chinese-brokered rapprochement, while the outbreak of the Gaza war later the same year soured relations between all Arab states and Israel.","Thu, 17 Apr 2025 13:32:38 GMT",https://thesun.my/world-news/un-nuclear-chief-says-iran-us-running-out-of-time-to-secure-deal-FN13964735,The Sun Daily,Malaysia,en,Today,50
China ready to share rare earth processing technology with Malaysia,"TAPAH : China is ready to share its rare earth processing technology with Malaysia - a move that could substantially boost the commodity’s value in the global market. Foreign Minister Datuk Seri Mohamad Hasan said that rare earth processing not only boosts national revenue but also benefits state governments, as mineral resources fall under their jurisdiction. “President Xi Jinping himself stated during yesterday’s meeting between Malaysia and China that they are willing to share the technology. “Rare earth is a gift from Allah SWT to Malaysia. If we sell it raw and unprocessed, the value is relatively low, but once processed, its value increases significantly – by as much as 10 to 15 times,” the Barisan Nasional (BN) deputy chairman told reporters at the Batu Tiga polling district centre here today. Xi’s three-day state visit to Malaysia, which began on Tuesday, was at the invitation of His Majesty Sultan Ibrahim, King of Malaysia. The visit is Xi’s second official visit to Malaysia in 12 years, after the first in 2013, which saw the two countries upgrade diplomatic relations to a Comprehensive Strategic Partnership.","Thu, 17 Apr 2025 13:26:38 GMT",https://thesun.my/malaysia-news/china-ready-to-share-rare-earth-processing-technology-with-malaysia-EN13964707,The Sun Daily,Malaysia,en,Today,50
"Anwar, Paetongtarn reaffirm ASEAN’s collective stand on US tariffs","BANGKOK : Prime Minister Datuk Seri Anwar Ibrahim and his Thai counterpart, Paetongtarn Shinawatra have reaffirmed their commitment to addressing the issue of United States (US) tariffs collectively at the ASEAN level. Anwar, currently on a two-day working visit to Thailand, said delegations from both Malaysia and Thailand discussed the matter during their bilateral meeting. “We also deliberated on the issue of US tariffs and reaffirmed our commitment to addressing it collectively at the ASEAN level through a fair and sustainable negotiation framework,” he said during the bilateral meeting with Paetongtarn at Government House here today. Anwar expressed his appreciation to the Thai prime minister for her commitment to strengthening bilateral ties. “I value the Thai government’s willingness to continue advancing existing agreements, particularly those aimed at enhancing the economies of northern Malaysia and southern Thailand. “With Thailand now Malaysia’s sixth-largest trading partner, and total trade exceeding US$25 billion last year, these initiatives will help us achieve our US$30 billion target by 2027,” he said. Earlier, Anwar and Paetongtarn witnessed the signing of a memorandum of understanding (MoU) concerning the construction agreement (CA) for the Rantau Panjang-Sungai Golok Bridge Project. Meanwhile in a press conference, Paetongtarn said three main topics were discussed with Anwar: the Sungai Golok Bridge project, peace in Thailand’s southern provinces, and US tariffs. Regarding the Sungai Golok Bridge, she said construction is ongoing and is expected to be completed on schedule. “As for peace in southern Thailand, we sought Malaysia’s cooperation, with a primary focus on economic development. This includes initiatives such as halal food production and the Rubber City project. “We agreed on transforming the ‘battlefield’ into a ‘trade field’ to promote cooperation and mutual economic benefits,” she said. Paetongtarn also noted that both leaders discussed how ASEAN member states could respond collectively to US tariffs. “ASEAN has a large population and significant potential if we act in unison. We also explored the different strategies that each country is adopting and agreed that every nation would proceed with its respective approach,” she said.","Thu, 17 Apr 2025 13:23:51 GMT",https://thesun.my/malaysia-news/anwar-paetongtarn-reaffirm-asean-s-collective-stand-on-us-tariffs-MN13964679,The Sun Daily,Malaysia,en,Today,50
